date,code,rank,brand,product,price,star,review
20260406,965923434,1,홀베리, 홀베리 유기농 레몬즙 10포 ,5000,4.8,48
20260406,600000145,2,대웅제약, 대웅제약 rTG 오메가3 30캡슐 30일분 ,5000,4.8,2245
20260406,600000144,3,대웅제약, 대웅제약 코엔자임 Q10 30캡슐 30일분 ,5000,4.8,1870
20260406,600000131,4,대웅제약, 대웅제약 바나바잎 추출물 30정 (30일분) ,3000,4.8,1314
20260406,600000128,5,대웅제약, 대웅제약 마그네슘 30정 30일분 ,3000,4.8,1380
20260406,613602085,6,닥터블릿, 닥터블릿 푸응 7days 팻버닝 21캡슐 ,5000,4.6,867
20260406,982725198,7,미니, 미니 초코룹스 쿠키 40 g ,1000,4.8,604
20260406,032627034,8,자연관, 자연관 이지슬로 엑스트라버진 올리브오일＆레몬 4병 ,5000,4.7,294
20260406,972080008,9,코코넛칩, 코코넛칩 50 g ,1500,4.7,1216
20260406,600000148,10,대웅제약, 대웅제약 칼슘 마그네슘 비타민D 60정 30일분 ,5000,4.8,1028
20260406,104557041,11,오뚜기, 오뚜기 참깨라면 110 g ,1000,4.9,619
20260406,600000126,12,대웅제약, 대웅제약 루테인 30정 30일분 ,3000,4.8,1364
20260406,100308732,13,실카, 실카 초콜릿 위드 아몬드 38 g  ,500,4.8,547
20260406,600000135,14,대웅제약, 대웅제약 멀티비타민 미네랄 30정 30일분 ,5000,4.8,1164
20260406,985472642,15,안국약품, 안국약품 콜린 미오이노시톨 4000 10포 ,5000,4.8,394
20260406,600000136,16,대웅제약, 대웅제약 녹차카테킨 30정 30일분 ,5000,4.8,1086
20260406,610910677,17,동국제약, 동국제약 이너케어＆유산균 30캡슐 ,5000,4.8,699
20260406,928300326,18,일리, 일리 클래식 로스트 12개입 ,3000,4.8,629
20260406,947020016,19,청해, 청해 오찡어 소면 30 g ,2000,4.7,587
20260406,002901705,20,멜로, 멜로 빅 머쉬멜로우 100g ,1000,4.9,455
20260406,600651649,21,유한양행, 유한양행 장건강 생유산균 30캡슐 30일분 ,5000,,0
20260406,600000134,22,대웅제약, 대웅제약 밀크씨슬 30정 30일분 ,5000,4.8,1173
20260406,600000127,23,대웅제약, 대웅제약 비타민C 30정 30일분 ,5000,4.8,676
20260406,600651654,24,유한양행, 유한양행 산뜻해질 생유산균 20캡슐 20일분 ,5000,4.8,29
20260406,120420584,25,청우, 청우 쫀득 초코칩 커피 맛 90 g ,1500,4.7,1135
20260406,600000132,26,대웅제약, 대웅제약 비타민D 4000IU 30정 30일분 ,3000,4.8,816
20260406,600000204,27,대웅제약, 대웅제약 마그네슘 샷 25ml x 5병 5일분 ,5000,4.9,195
20260406,600000139,28,대웅제약, 대웅제약 쏘팔메토 옥타코사놀 30캡슐 30일분 ,5000,4.8,664
20260406,106201275,29,롯데, 롯데 초코필드 빼빼로 53 g ,1500,4.9,403
20260406,033801971,30,호올스, 호올스 XS 멘토립터스 멘톨 향 캔디 15 g ,1000,4.8,558
20260406,613602130,31,오브맘, 오브맘 비타민D＆아연 하루구미 30일분 ,5000,4.8,354
20260406,126800650,32,동아, 동아 이브로 칠리콘 스낵 75 g ,1000,4.7,812
20260406,600000129,33,대웅제약, 대웅제약 비타민B 30정 30일분 ,3000,4.8,830
20260406,033801904,34,호올스, 호올스 XS 레몬민트 향 캔디 15 g ,1000,4.8,668
20260406,104515136,35,오뚜기, 오뚜기 맛있는 공깃밥 200 g ,1000,4.9,270
20260406,100308740,36,실카, 실카 초콜릿 위드 크리스피 36g ,500,4.8,581
20260406,104502799,37,진라면, 진라면 스프 5g 10개입 매운맛 ,3000,4.9,381
20260406,106286189,38,롯데, 롯데 꼬깔콘 군옥수수맛 52 g ,1000,4.9,49
20260406,190616329,39,코스모스, 코스모스 두부 과자 110g ,1000,4.7,1700
20260406,105200406,40,고구마, 고구마 츄 60 g ,2000,4.7,374
20260406,925667463,41,허쉬, 허쉬 초콜릿 칩 미니 쿠키 50 g ,1000,4.7,942
20260406,531910960,42,포테이토, 포테이토 크리스프 사워크림 75g ,1000,4.8,976
20260406,947020042,43,쫀쫀이, 쫀쫀이 오징어 스틱 30 g ,2000,4.8,251
20260406,45173653,44,메이지, 메이지 초코 베이비 32 g ,2000,4.9,467
20260406,947020105,45,청해, 청해 땅콩버터맛 오징어 30g ,2000,4.8,722
20260406,611982831,46,안국약품, 안국약품 토비콤 루테인 지아잔틴 미니 30캡슐 ,5000,4.8,532
20260406,926940063,47,추억의, 추억의 과자 꾀돌이 75 g ,1000,4.8,443
20260406,600000133,48,대웅제약, 대웅제약 철분 30정 30일분 ,3000,4.8,744
20260406,104557163,49,오뚜기, 오뚜기 진라면 용기 매운맛 110 g ,1000,4.9,177
20260406,111118048,50,크라운, 크라운 빅파이 216 g ,2000,4.8,248
20260406,277534494,51,게리, 게리 치즈 크래커 72 g ,1000,4.8,721
20260406,949558093,52,도드람, 도드람 고기 찍먹 양념 세트 72 g ,1000,4.8,311
20260406,982725043,53,허쉬, 허쉬 초코팝콘 50g ,1000,4.8,837
20260406,221300592,54,셈볼, 셈볼 누가 초코바 ,500,4.8,114
20260406,902596193,55,애사비, 애사비 톡 매실 5 g X 10개입 ,3000,4.8,380
20260406,965923433,56,홀베리, 홀베리 유기농 레몬자몽즙 10포 ,5000,4.6,80
20260406,964455540,57,본죽, 본죽 얼큰 낙지 김치죽 200g ,2000,4.5,565
20260406,139213437,58,CJ, CJ 카무트 곡물과채콤부 화사 효소 10포 10일분 ,5000,4.8,430
20260406,109446260,59,휘오, 휘오 순수 500 ml ,500,4.8,88
20260406,031930043,60,닥터블릿, 닥터블릿 멜라드림 30정 30일분 ,5000,4.8,215
20260406,591580521,61,종근당건강, 종근당건강 락토핏 골드 ,5000,4.8,692
20260406,600651650,62,유한양행, 유한양행 비피더스 생유산균 10캡슐 10일분 ,5000,,0
20260406,190616902,63,코스모스, 코스모스 왕소라형 과자 138 g ,1000,4.7,934
20260406,106238271,64,롯데, 롯데 쌀로 만든 쌀로별 고소한 맛 62 g ,1000,4.9,36
20260406,600651648,65,유한양행, 유한양행 장건강 생유산균 스틱 30포 30일분 ,5000,5.0,20
20260406,600132084,66,코피코, 코피코 캔디 100 g 커피 맛 ,1500,4.8,542
20260406,106286179,67,롯데, 롯데 치토스 매콤달콤맛 64 g ,1000,4.9,38
20260406,106286178,68,롯데, 롯데 치토스 스모키바베큐맛 64 g ,1000,4.9,38
20260406,496300224,69,미고랭, 미고랭 라면 70 g ,1000,4.7,472
20260406,225903045,70,롯데, 롯데 ABC 초코 60 g ,2000,4.7,29
20260406,104557309,71,오뚜기, 오뚜기 스낵면 용기 90 g ,1000,4.8,204
20260406,938846464,72,이디야, 이디야 비니스트 오리지널 아메리카노 1 g X 12개입 ,2000,4.8,206
20260406,600000206,73,대웅제약, 대웅제약 베르베린 500 30정 30일분 ,5000,4.8,148
20260406,574247432,74,하이디라오, 하이디라오 마라펀 ,2000,4.8,265
20260406,289600078,75,호박, 호박 꿀맛나 100g ,1000,4.8,444
20260406,982725060,76,허쉬, 허쉬 초콜릿 칩 모찌 쿠키 90 g ,1500,4.8,608
20260406,646710533,77,프링글스, 프링글스 오리지널 53 g ,1500,4.8,376
20260406,591580541,78,종근당건강, 종근당건강 눈건강엔 루테인지아잔틴 ,5000,4.8,569
20260406,106201270,79,롯데, 롯데 오리지널 빼빼로 54 g ,1500,4.7,206
20260406,947020019,80,청해, 청해 대왕 오징어 롱다리 30 g ,2000,4.6,179
20260406,901762097,81,자연관, 자연관 홍삼정 에너타임 10포 ,5000,4.8,408
20260406,106224743,82,롯데, 롯데 칙촉 120 g ,2000,4.9,18
20260406,600651652,83,유한양행, 유한양행 초코맛 생유산균 스틱 20포 20일분 ,5000,4.8,11
20260406,600000203,84,대웅제약, 대웅제약 식물성 뉴티지 오메가3 30캡슐 30일분 ,5000,4.7,250
20260406,190616519,85,코스모스, 코스모스 버터갈릭 새우칩 56g ,1000,4.8,1474
20260406,104557457,86,오뚜기, 오뚜기 진짬뽕 미니컵 75 g ,1000,4.9,141
20260406,947020018,87,청해, 청해 꼬꼬마 오징어 숏다리 30g ,2000,4.8,642
20260406,483400937,88,게메즈, 게메즈 에낙 30 g X 4개입 ,2000,4.9,104
20260406,104568419,89,오뚜기, 오뚜기 컵누들 참깨 라면 ,1500,4.8,97
20260406,921556550,90,추억, 추억 나눔 뻥튀기 44 g ,1000,4.8,438
20260406,600000152,91,대웅제약, 대웅제약 콘드로이친 30정 30일분 ,5000,4.7,449
20260406,262605102,92,코코넛, 코코넛 크래커 56.25 g ,1000,4.7,577
20260406,104556003,93,오뚜기, 오뚜기 뿌셔뿌셔 불고기 맛 90 g X 2개입 ,1500,4.8,249
20260406,964455538,94,본죽, 본죽 쇠고기죽 200g ,2000,4.7,276
20260406,104557458,95,오뚜기, 오뚜기 진짬뽕 용기 115 g ,1500,4.9,148
20260406,155890322,96,움트리, 움트리 쇠고기 볶음고추장 100g ,2000,4.8,575
20260406,921556555,97,녹차, 녹차 맛 강냉이 과자 80 g ,1000,4.8,387
20260406,925667703,98,오트밀, 오트밀 미니 바이트 40g ,1000,4.9,546
20260406,600000130,99,대웅제약, 대웅제약 글루타치온 30정 30일분 ,5000,4.8,800
20260406,113300016,100,머거본, 머거본 알 땅콩 55g ,1000,4.8,332
20260406,600000138,101,대웅제약, 대웅제약 콜라겐 60정 30일분 ,5000,4.8,577
20260406,458877369,102,북해도, 북해도 우유 모찌 40 g ,2000,4.4,639
20260406,104529032,103,오뚜기, 오뚜기 3분카레 매운맛 200 g ,1500,5.0,143
20260406,012600604,104,로투스, 로투스 비스코프 125 g ,1500,4.8,515
20260406,613602146,105,자연관, 자연관 바이탈 밀크씨슬＆비타민B 4병 ,5000,4.8,83
20260406,099715606,106,드롭, 드롭 어소티드 소프트캔디 75g ,1000,4.9,367
20260406,944182826,107,허쉬, 허쉬 초코 아몬드 찰떡 파이 88 g ,1500,4.7,492
20260406,600000207,108,대웅제약, 대웅제약 알파CD ZERO 15포 15일분 ,5000,4.8,107
20260406,964455539,109,본죽, 본죽 보양 삼계죽 200g ,2000,4.8,284
20260406,961794509,110,허니, 허니 버터 아몬드 40g ,1500,4.9,267
20260406,289600277,111,빼빼어포, 빼빼어포 오리지널 24g ,1000,4.8,501
20260406,702591115,112,하타리, 하타리 말키스트 120 g 초콜릿 맛 ,1000,4.7,357
20260406,600651651,113,유한양행, 유한양행 프레쉬츄 생유산균 30정 30일분 ,5000,4.8,14
20260406,252021099,114,추억의, 추억의 차카니 60g ,1000,4.7,446
20260406,917054202,115,테일러팜스, 테일러팜스 테일러 푸룬 50 g ,1500,4.7,353
20260406,289600520,116,철판에, 철판에 메메 잘 구운 쥐포 48g ,2000,4.6,352
20260406,204942093,117,카스텔크렘, 카스텔크렘 레몬 캔디 50 g ,2000,4.8,574
20260406,921440142,118,행복한, 행복한 쇼콜라띠에 화이트초코 100 g ,2000,4.9,274
20260406,646710535,119,프링글스, 프링글스 사워크림 앤 어니언 53 g ,1500,4.8,512
20260406,942788230,120,광천, 광천 재래 곱창 김 4 g X 3봉 ,1000,4.8,149
20260406,106288364,121,롯데, 롯데 크런키 빼빼로 39 g ,1500,4.9,179
20260406,104514115,122,오뚜기, 오뚜기 골드 마요네즈 200 g ,2000,4.8,247
20260406,286314184,123,영진, 영진 비타민D 1000IU 아연 츄어블 12정 ,1000,4.8,34
20260406,902596192,124,애사비, 애사비 톡 사과 5 g X 10개입 ,3000,4.9,358
20260406,610910603,125,동국제약, 동국제약 마데카 저분자 콜라겐C ,5000,4.8,261
20260406,113300431,126,민속, 민속 통 육포 35g ,2000,4.8,488
20260406,104529401,127,오뚜기, 오뚜기 3분 김치참치덮밥 소스 150 g ,1500,4.8,189
20260406,951817120,128,[한정수량, [한정수량 랜덤 스티커 포함] 락피도 티니핑 철분스틱 12포 ,5000,4.9,106
20260406,104529130,129,오뚜기, 오뚜기 3분 짜장 200 g ,1500,4.8,168
20260406,949000068,130,피오디, 피오디 레몬즙 200 ml ,1500,4.9,525
20260406,49811353,131,모리나가, 모리나가 라무네 포도당 캔디 29 g ,1000,4.7,477
20260406,120400494,132,청우, 청우 참깨스틱 ,1500,4.8,588
20260406,113300102,133,머거본, 머거본 커피 땅콩 55g ,1000,4.8,455
20260406,699520507,134,미성, 미성 화이트 캐슬 버터 쿠키 ,1000,4.7,877
20260406,120420547,135,청우, 청우 사르르 버터 쿠키 83 g ,1000,4.7,655
20260406,106289354,136,롯데, 롯데 ABC 초코 쿠키 50 g ,1000,4.9,14
20260406,942788229,137,광천김, 광천김 재래도시락김(4 gx3봉) ,1000,4.8,273
20260406,286314181,138,영진, 영진 비타민C 츄어블 12정 ,1000,4.6,20
20260406,104529941,139,오뚜기, 오뚜기 옛날 사골곰탕 350 ml ,1000,4.8,176
20260406,104502247,140,오뚜기, 오뚜기 보들보들 치즈 볶음면 매운맛 ,1500,4.9,17
20260406,610910601,141,동국제약, 동국제약 마데카 리포좀 레티놀C 20포 ,5000,4.8,347
20260406,600000149,142,대웅제약, 대웅제약 MSM 90정 30일분 ,5000,4.8,399
20260406,443310128,143,고소한, 고소한 치즈봉 90 g ,1500,4.7,222
20260406,121609907,144,하리보, 하리보 믹스 사우어 80 g ,1500,4.9,266
20260406,905440019,145,요뽀끼, 요뽀끼 치즈 떡볶이 120 g ,2000,4.7,525
20260406,600651647,146,유한양행, 유한양행 프리바이오틱스 스틱 40포 20일분 ,5000,,0
20260406,600132083,147,코피코, 코피코 캔디 100 g 카푸치노 맛 ,1500,4.9,403
20260406,104529031,148,오뚜기, 오뚜기 3분 카레 약간매운맛 200 g ,1500,4.9,146
20260406,942788193,149,두, 두 번 구운 김밥 김 10매입 ,2000,4.8,246
20260406,712266879,150,망고큐브젤리(50, 망고큐브젤리(50 g) ,1000,4.7,640
20260406,76224935,151,밀카, 밀카 초코 슈프림 30 g ,1000,4.5,48
20260406,120420600,152,청우, 청우 그랑쉘 딸기 ,1500,4.8,185
20260406,277534495,153,게리, 게리 살룻 코코넛 76 g ,1000,4.7,442
20260406,120420585,154,청우, 청우 찹쌀 모나카 65 g ,1500,4.8,590
20260406,430009152,155,록키마운틴, 록키마운틴 마쉬멜로우 화이트 150 g 레귤러 ,3000,4.9,14
20260406,104551251,156,오뚜기, 오뚜기 컵누들 마라탕 맛 ,1500,4.8,105
20260406,951817119,157,[한정수량, [한정수량 랜덤 스티커 포함] 락피도 티니핑 비타스틱 12포 ,5000,4.9,97
20260406,002990203,158,미성, 미성 멜로 머쉬멜로우 ,1000,4.8,107
20260406,286314174,159,닥터블릿, 닥터블릿 푸응 7days 데일리버닝 14포 7일분 ,5000,4.6,65
20260406,994953531,160,LG생활건강, LG생활건강 이너뷰 히알루론산 더마스틱 12포 ,5000,4.8,145
20260406,032627033,161,자연관, 자연관 스파이크컷 바나바잎＆카테킨 4병 ,5000,4.7,113
20260406,104529405,162,오뚜기, 오뚜기 3분 제육덮밥 소스 150 g ,1500,4.8,155
20260406,932294263,163,참소스, 참소스 275g ,2000,4.9,525
20260406,905440384,164,요뽀끼, 요뽀끼 매콤 까르보나라 떡볶이 120 g ,2000,4.8,517
20260406,531910918,165,포테이토, 포테이토 크리스프 바베큐맛 75g ,1000,4.8,684
20260406,531910198,166,해피무, 해피무 초코렛 비스켓 80 g ,1000,4.8,392
20260406,289600432,167,월드컵, 월드컵 맛기차 콘 84g  ,1000,4.9,278
20260406,109405260,168,닥터페퍼, 닥터페퍼 500 ml ,1500,4.7,81
20260406,982725115,169,허쉬, 허쉬 바닐라 크림 샌드위치 쿠키 75 g ,1000,4.8,430
20260406,456322014,170,오라이시, 오라이시 베트남쌀국수컵(71 g) ,1500,4.6,10
20260406,951817122,171,[한정수량, [한정수량 랜덤 스티커 포함] 락피도 티니핑 아르기닌스틱 12포 ,5000,4.9,96
20260406,994953528,172,LG생활건강, LG생활건강 이너뷰 콜라겐 더마스틱 7포 ,5000,4.7,121
20260406,104557136,173,오뚜기, 오뚜기 진라면 용기 순한맛 110 g ,1000,4.9,105
20260406,190616407,174,코스모스, 코스모스 트위스트 128 g ,1000,4.8,518
20260406,104520221,175,오뚜기, 오뚜기 사과 식초 500 ml ,1500,4.8,195
20260406,994953532,176,LG생활건강, LG생활건강 이너뷰 비눌린 워터믹스 10포 ,5000,4.5,54
20260406,902596195,177,애사비, 애사비 톡 오미자 5 g X 10개입 ,3000,4.8,210
20260406,104557028,178,오뚜기, 오뚜기 진라면 매운맛 작은컵 6개입 ,5000,4.9,181
20260406,104529404,179,오뚜기, 오뚜기 3분 춘천 닭갈비 덮밥 소스 150 g ,1500,4.9,181
20260406,965923424,180,홀베리, 홀베리 유기농 레몬생강즙 10포 ,5000,4.7,61
20260406,155890321,181,움트리, 움트리 생와사비 43g ,2000,4.8,492
20260406,939534043,182,우주, 우주 추억의 달고나 45g  ,1000,4.7,351
20260406,104529330,183,오뚜기, 오뚜기 3분 하이라이스 소스 200 g ,1500,4.8,122
20260406,961794805,184,바프, 바프 와사비맛 땅콩 55g ,1000,4.8,354
20260406,629180143,185,타타와, 타타와 초콜릿 쿠키 60 g ,1000,4.7,399
20260406,225902109,186,롯데, 롯데 자일리톨 알파 용기 48 g ,2000,5.0,14
20260406,027945156,187,바프, 바프 군옥수수 맛 아몬드＆땅콩 35 g ,1000,4.8,96
20260406,951817121,188,[한정수량, [한정수량 랜덤 스티커 포함] 락피도 티니핑 쾌변스틱 12포 ,5000,4.8,92
20260406,921556557,189,앵두콘, 앵두콘 과자 80 g ,1000,4.6,318
20260406,610910602,190,동국제약, 동국제약 마데카 리포좀 글루타치온C 20포 ,5000,4.8,415
20260406,289600280,191,빼빼어포, 빼빼어포 매운맛 24 g ,1000,4.9,170
20260406,221024842,192,밀카, 밀카 초코무 40 g ,1000,4.8,88
20260406,113300074,193,머거본, 머거본 칼몬드 35 g ,2000,4.9,80
20260406,104576228,194,진라면, 진라면 스프 5g 10개입 순한맛 ,3000,4.8,155
20260406,982725153,195,리치, 리치 허니 쌀과자 120 g ,2000,4.8,306
20260406,938846639,196,이디야, 이디야 클래식 커피믹스 20개입 ,3000,4.6,154
20260406,106201274,197,롯데, 롯데 초코쿠키 빼빼로 37 g ,1500,4.8,126
20260406,913624078,198,오브맘," 오브맘 스트레스,쉼 30일분 ",5000,4.8,255
20260406,924797580,199,해츠쟈, 해츠쟈 쏸라펀 마라탕 128 g ,2000,4.7,278
20260406,913624074,200,오브맘, 오브맘 비타민C 플러스 톡톡! 30일분 ,5000,4.9,236
20260406,288897426,201,모리나가, 모리나가 하이츄 스윗 앤 사우어 90g ,2000,4.9,288
20260406,111533852,202,서울우유, 서울우유 딸기우유 맛 젤리 45 g ,1000,4.4,304
20260406,901762093,203,자연관, 자연관 정성담은 배도라지스틱 12포 ,5000,4.8,317
20260406,120400778,204,청우, 청우 미니 웨하스 바닐라 맛 80 g ,1000,4.7,428
20260406,994953534,205,LG생활건강, LG생활건강 이너뷰 칼륨밸런스 전해질워터 10포 ,5000,4.8,251
20260406,924797540,206,생고구맛탕, 생고구맛탕 칩 80 g ,2000,4.5,223
20260406,902596194,207,애사비, 애사비 톡 블루베리 5 g X 10개입 ,3000,4.8,208
20260406,120420568,208,청우, 청우 고구마 모나카 65g ,1500,4.6,937
20260406,120400779,209,청우, 청우 미니 웨하스 딸기 맛 80 g ,1000,4.7,470
20260406,948699232,210,무직타이거, 무직타이거 찹쌀손약과 60g ,1000,4.7,254
20260406,289600434,211,호박쫀드기, 호박쫀드기 84g ,1000,4.7,212
20260406,913624077,212,오브맘, 오브맘 기억력 그린라이트 30일분 ,5000,4.7,194
20260406,283672625,213,롯데, 롯데 허쉬 스페셜 크리에이션 스트로베리 38 g ,1500,4.3,15
20260406,113300101,214,머거본, 머거본 꿀땅콩 55g ,1000,4.8,385
20260406,948699283,215,와사비, 와사비 스낵 90 g ,2000,4.7,206
20260406,935817111,216,출출할땐, 출출할땐 출추리 훈제맛(25 g) ,1500,4.7,180
20260406,106285941,217,롯데, 롯데 키세스 쿠앤크 31 g ,1000,,0
20260406,629180141,218,타타와, 타타와 블루베리잼 쿠키 60 g ,1000,4.7,269
20260406,491844112,219,보성제다, 보성제다 아름다운 둥글레차 14.4g (1.2gx12티백) ,1000,4.8,246
20260406,336800055,220,알버트, 알버트 동전 초콜릿 망 55 g ,2000,4.7,22
20260406,289600542,221,빼빼, 빼빼 어포 오리지널 60 g ,2000,4.8,58
20260406,121609555,222,하리보, 하리보 웜즈 사우어 80 g ,1500,4.9,250
20260406,112300214,223,칸타타, 칸타타 디카페인 블렌드 드립백 10 g X 9개입 ,5000,4.9,40
20260406,104557068,224,오뚜기, 오뚜기 열라면 작은컵 6개입 ,5000,4.9,154
20260406,104552631,225,오뚜기, 오뚜기 진비빔면 멀티팩 156 g  X 4개입 ,3000,4.8,133
20260406,027945154,226,바프, 바프 허니 버터 아몬드＆땅콩 35 g ,1000,4.8,136
20260406,949753218,227,쏠라C, 쏠라C 블루베리 맛 30개입 ,3000,4.9,148
20260406,155890324,228,움트리, 움트리 순후추 50 g ,3000,4.8,283
20260406,106285943,229,롯데, 롯데 키세스 밀크 31 g ,1000,,0
20260406,591591440,230,종근당건강, 종근당건강 브이퍼센트 멀티비타민 타우린샷 5포 ,5000,4.8,179
20260406,283672623,231,롯데, 롯데 허쉬 스페셜 크리에이션 초코티라미수 38 g ,1500,4.8,11
20260406,102495503,232,청정원, 청정원 멸치 쌀국수 92 g ,2000,4.8,282
20260406,478200699,233,감자알칩, 감자알칩 치즈 마요 맛 38 g ,1000,4.7,304
20260406,168637575,234,하리보, 하리보 프루티 부시 100 g ,1500,4.8,311
20260406,938846609,235,이디야, 이디야 스페셜 모카 블렌드 커피믹스 30개입 ,5000,4.7,88
20260406,802403401,236,쟈뎅, 쟈뎅 바리스타 싱글오리진 브라질 캡슐 커피 다크 10개입 ,5000,4.9,101
20260406,924797586,237,초코, 초코 틴인틴 89 g ,1500,4.8,215
20260406,317836739,238,유니콘, 유니콘 롤스 19 g ,500,4.8,81
20260406,225903050,239,롯데, 롯데 드림 카카오 볼 56% 48 g ,2000,,0
20260406,980562147,240,사우어, 사우어 롤더벨트 딸기 40g ,1000,4.8,90
20260406,955960244,241,챠챠, 챠챠 해바라기씨 양념 맛 45 g ,1000,4.7,318
20260406,926940051,242,뉴트리크라프트, 뉴트리크라프트 에너지 포도당 캔디 70 g ,2000,4.8,235
20260406,944502262,243,호올스, 호올스 자몽 향 캔디 2개입 ,1500,4.9,248
20260406,289600433,244,옥수수, 옥수수 쫀드기 84g ,1000,4.8,269
20260406,951817118,245,[한정수량, [한정수량 랜덤 스티커 포함]  락피도 티니핑 칼슘스틱 12포 ,5000,4.8,63
20260406,947020027,246,청해추억의빵쥐포(40, 청해추억의빵쥐포(40 g) ,2000,4.8,155
20260406,600000202,247,대웅제약, 대웅제약 활성엽산400 30정 30일분 ,5000,4.7,74
20260406,962380022,248,모리나가, 모리나가 하이츄 트로피컬 믹스 90g ,2000,4.9,226
20260406,600000142,249,대웅제약, 대웅제약 멀티비타민 미네랄 츄어블 60정 30일분 ,5000,4.8,255
20260406,961794514,250,바프, 바프 카라멜 솔티드 아몬드 앤 프레첼 40 g ,1500,4.7,211
20260406,643701702,251,오키오, 오키오 구미 100 g 그레이프 ,1500,4.8,60
20260406,245610506,252,치즈, 치즈 앤 미트 스키니 육포 30 g ,2000,4.8,103
20260406,203590173,253,하리보, 하리보 스타 믹스 100 g ,1500,4.9,190
20260406,015740573,254,벤토, 벤토 바베큐 앤 스파이시 12 g ,1000,4.8,158
20260406,600651655,255,유한양행, 유한양행 운동부스터 생유산균 스틱 5포 5일분 ,5000,,0
20260406,104529030,256,오뚜기, 오뚜기 3분 카레 순한맛 200 g ,1500,4.9,83
20260406,956842650,257,0칼로리, 0칼로리 설탕 대신 알룰로스 450 g ,5000,4.7,98
20260406,600000151,258,대웅제약, 대웅제약 숙취해소 노니샷 5포 5회분 ,5000,4.8,158
20260406,154404007,259,밀펑, 밀펑 과자 70 g ,1000,4.7,276
20260406,961794511,260,HBAF, HBAF 와사비맛 아몬드 40g ,1500,4.8,193
20260406,948699024,261,크래용, 크래용 신짱 라면 스낵 바베큐 맛 90 g ,1000,4.6,344
20260406,938846608,262,이디야, 이디야 스페셜 골드 블렌드 리치 크레마 커피믹스 30개입 ,5000,4.8,70
20260406,927502352,263,요거트, 요거트 샌드 웨이퍼 56 g ,3000,4.7,288
20260406,976195479,264,스키니랩, 스키니랩 프레스팝 멀티비타민 사과 맛 4개입 ,5000,4.7,141
20260406,913624076,265,오브맘, 오브맘 눈건강 아이라이트 30일분 ,5000,4.8,132
20260406,289600420,266,꼬마, 꼬마 꾸이킹 오리지널 25g ,1000,4.8,273
20260406,109436270,267,파워에이드, 파워에이드 마운틴 블라스트 600ml ,1500,4.9,127
20260406,951817123,268,[한정수량, [한정수량 랜덤 스티커 포함] 락피도 티니핑 빌베리스틱 12포 ,5000,4.9,93
20260406,924797423,269,두부두부, 두부두부 야채 스낵 80 g ,1500,4.8,281
20260406,111194423,270,크라운, 크라운 카라멜 콘 땅콩 125 g ,2000,4.7,66
20260406,283672621,271,롯데, 롯데 허쉬 라지바 90 g 아몬드 ,3000,,0
20260406,155860026,272,움트리, 움트리 실장님 회 초장 300g ,2000,4.8,179
20260406,104510411,273,오뚜기, 오뚜기 1/2 하프 케찹 280 g ,2000,4.9,123
20260406,802403403,274,쟈뎅, 쟈뎅 바리스타 싱글오리진 브라질 캡슐 커피 디카페인 10개입 ,5000,4.7,103
20260406,274710519,275,헬로키티, 헬로키티 껌 27.5 g ,1000,4.7,182
20260406,643701699,276,오키오, 오키오 구미 100 g 망고 ,1500,4.8,46
20260406,599960104,277,복음자리짜먹는딸기잼, 복음자리짜먹는딸기잼 ,2000,4.8,122
20260406,109498420,278,씨그램, 씨그램 플레인 350 ml ,1000,4.7,21
20260406,109408260,279,코카콜라, 코카콜라 제로 500 ml ,2000,4.8,107
20260406,976195494,280,스키니랩, 스키니랩 프레스팝 멀티비타민 포도 맛 4개입 ,5000,4.6,130
20260406,591591420,281,종근당건강, 종근당건강 브이퍼센트 멀티비타민 콜라겐샷 5포 ,5000,4.9,113
20260406,591580891,282,종근당건강, 종근당건강 락토핏 간케어 20포 ,5000,4.7,119
20260406,283672627,283,롯데, 롯데 허쉬 스페셜 크리에이션 초코치즈 38 g ,1500,4.6,10
20260406,168630155,284,하리보, 하리보 골드베렌 100g ,1500,4.8,237
20260406,111800103,285,롯데, 롯데 카놀라유 500 ml ,3000,,0
20260406,106200942,286,롯데, 롯데 제크 65 g ,1000,4.8,11
20260406,104557010,287,오뚜기진라면순한맛작은컵6입, 오뚜기진라면순한맛작은컵6입 ,5000,4.9,96
20260406,982725183,288,온실, 온실 와사비 칩 ,1000,4.7,181
20260406,927502252,289,자일스톤, 자일스톤 레몬 향 20 g ,2000,4.7,213
20260406,918057101,290,한주, 한주 본 소금 1kg ,2000,4.8,189
20260406,610910727,291,동국제약, 동국제약 리포좀 마그마 스피드 30정 ,5000,4.7,106
20260406,111194673,292,크라운, 크라운 죠리퐁 138 g ,2000,4.8,87
20260406,724020430,293,피시, 피시 스낵 스파이스맛 27g ,1000,4.7,211
20260406,458820215,294,꿀사과, 꿀사과 모찌 40 g ,2000,4.3,341
20260406,289600457,295,철판, 철판 꾸이킹 오리지널 22 g ,1000,4.8,204
