date,code,rank,brand,product,price,star,review
20260419,610910967,1,동국, 동국 맛있는 샐러드 미니볼 비타 15포 15일분 ,3000,4.6,20
20260419,601618636,2,동화, 동화 부채표 편안활 5포 5일분 ,3000,4.9,162
20260419,104515136,3,오뚜기, 오뚜기 맛있는 공깃밥 200 g ,1000,4.9,309
20260419,982725198,4,미니, 미니 초코룹스 쿠키 40 g ,1000,4.8,732
20260419,600000145,5,대웅제약, 대웅제약 rTG 오메가3 30캡슐 30일분 ,5000,4.8,2471
20260419,600000144,6,대웅제약, 대웅제약 코엔자임 Q10 30캡슐 30일분 ,5000,4.8,2042
20260419,985472642,7,안국약품, 안국약품 콜린 미오이노시톨 4000 10포 ,5000,4.8,450
20260419,032627034,8,자연관, 자연관 이지슬로 엑스트라버진 올리브오일＆레몬 4병 ,5000,4.7,344
20260419,032306201,9,종근당, 종근당 데일리와이즈 혈당컷 다이어트 12정 12일분 ,2000,4.8,28
20260419,600000148,10,대웅제약, 대웅제약 칼슘 마그네슘 비타민D 60정 30일분 ,5000,4.8,1141
20260419,972080008,11,코코넛칩, 코코넛칩 50 g ,1500,4.7,1301
20260419,600000135,12,대웅제약, 대웅제약 멀티비타민 미네랄 30정 30일분 ,5000,4.8,1303
20260419,965923434,13,홀베리, 홀베리 유기농 레몬즙 10포 ,5000,4.8,116
20260419,190616329,14,코스모스, 코스모스 두부 과자 110g ,1000,4.7,1787
20260419,600000126,15,대웅제약, 대웅제약 루테인 30정 30일분 ,3000,4.8,1472
20260419,002901705,16,멜로, 멜로 빅 머쉬멜로우 100g ,1000,4.9,494
20260419,610910677,17,동국제약, 동국제약 이너케어＆유산균 30캡슐 ,5000,4.8,820
20260419,600000128,18,대웅제약, 대웅제약 마그네슘 30정 30일분 ,3000,4.8,1549
20260419,100308732,19,실카, 실카 초콜릿 위드 아몬드 38 g  ,500,4.8,602
20260419,600000204,20,대웅제약, 대웅제약 마그네슘 샷 25ml x 5병 5일분 ,5000,4.9,252
20260419,928300326,21,일리, 일리 클래식 로스트 12개입 ,3000,4.8,691
20260419,106286189,22,롯데, 롯데 꼬깔콘 군옥수수맛 52 g ,1000,4.9,110
20260419,600000136,23,대웅제약, 대웅제약 녹차카테킨 30정 30일분 ,5000,4.8,1164
20260419,600000134,24,대웅제약, 대웅제약 밀크씨슬 30정 30일분 ,5000,4.8,1271
20260419,600000127,25,대웅제약, 대웅제약 비타민C 30정 30일분 ,5000,4.8,761
20260419,45173653,26,메이지, 메이지 초코 베이비 32 g ,2000,4.9,520
20260419,928300328,27,일리, 일리 클래식 로스트 디카페인 1g X 12개입 ,3000,4.8,292
20260419,947020042,28,쫀쫀이, 쫀쫀이 오징어 스틱 30 g ,2000,4.8,284
20260419,947020016,29,청해, 청해 오찡어 소면 30 g ,2000,4.7,607
20260419,100308740,30,실카, 실카 초콜릿 위드 크리스피 36g ,500,4.8,634
20260419,289600582,31,추억의, 추억의 어포 튀각 32 g ,1000,4.8,1104
20260419,033801971,32,호올스, 호올스 XS 멘토립터스 멘톨 향 캔디 15 g ,1000,4.8,597
20260419,600000132,33,대웅제약, 대웅제약 비타민D 4000IU 30정 30일분 ,3000,4.8,880
20260419,613602130,34,오브맘, 오브맘 비타민D＆아연 하루구미 30일분 ,5000,4.8,420
20260419,106201275,35,롯데, 롯데 초코필드 빼빼로 53 g ,1500,4.8,458
20260419,025575127,36,[다영, [다영 PICK] 셀트리온 브로멜라인＆알파 CD 30정 15일분 ,3000,,0
20260419,033801904,37,호올스, 호올스 XS 레몬민트 향 캔디 15 g ,1000,4.8,726
20260419,104502799,38,진라면, 진라면 스프 5g 10개입 매운맛 ,3000,4.8,504
20260419,600000129,39,대웅제약, 대웅제약 비타민B 30정 30일분 ,3000,4.8,901
20260419,947020019,40,청해, 청해 대왕 오징어 롱다리 30 g ,2000,4.6,201
20260419,613602124,41,자연관, 자연관 이뮨멀티비타민미네랄 4병 ,5000,4.8,754
20260419,120420584,42,청우, 청우 쫀득 초코칩 커피 맛 90 g ,1500,4.7,1198
20260419,600651649,43,유한양행, 유한양행 장건강 생유산균 30캡슐 30일분 ,5000,4.9,60
20260419,104557041,44,오뚜기, 오뚜기 참깨라면 110 g ,1000,4.9,690
20260419,919157053,45,휴럼, 휴럼 하루한포 6년근 고려홍삼 5포 5일분 ,2000,4.9,39
20260419,531910960,46,포테이토, 포테이토 크리스프 사워크림 75g ,1000,4.8,1043
20260419,949558093,47,도드람, 도드람 고기 찍먹 양념 세트 72 g ,1000,4.8,326
20260419,982725043,48,허쉬, 허쉬 초코팝콘 50g ,1000,4.8,889
20260419,601618637,49,동화, 동화 부채표 배도라지쌍화 5포 5일분 ,2000,4.8,29
20260419,225903046,50,롯데, 롯데 크런키 볼 46 g ,1500,4.9,45
20260419,947020105,51,청해, 청해 땅콩버터맛 오징어 30g ,2000,4.8,772
20260419,600000203,52,대웅제약, 대웅제약 식물성 뉴티지 오메가3 30캡슐 30일분 ,5000,4.7,303
20260419,032306203,53,종근당, 종근당 데일리와이즈 초임계 알티지 오메가3 12캡슐 12일분 ,2000,,0
20260419,925667463,54,허쉬, 허쉬 초콜릿 칩 미니 쿠키 50 g ,1000,4.7,995
20260419,139213437,55,CJ, CJ 카무트 곡물과채콤부 화사 효소 10포 10일분 ,5000,4.8,480
20260419,277534494,56,게리, 게리 치즈 크래커 72 g ,1000,4.8,765
20260419,610910678,57,동국제약, 동국제약 혈당케어＆유산균 30캡슐 ,5000,4.8,479
20260419,600000133,58,대웅제약, 대웅제약 철분 30정 30일분 ,3000,4.8,808
20260419,600651654,59,유한양행, 유한양행 산뜻해질 생유산균 20캡슐 20일분 ,5000,4.8,64
20260419,994953535,60,LG생활건강, LG생활건강 이너뷰 다이어트 가르시니아 10포 ,5000,4.7,207
20260419,105200406,61,고구마, 고구마 츄 60 g ,2000,4.7,400
20260419,601618638,62,동화, 동화 부채표쌍화 5포 5일분 ,2000,4.8,22
20260419,646710533,63,프링글스, 프링글스 오리지널 53 g ,1500,4.8,404
20260419,126800650,64,동아, 동아 이브로 칠리콘 스낵 75 g ,1000,4.7,860
20260419,613602129,65,오브맘, 오브맘 면역＆프로폴리스 하루구미 30일분 ,5000,4.7,346
20260419,190616902,66,코스모스, 코스모스 왕소라형 과자 138 g ,1000,4.7,981
20260419,968235549,67,안국약품, 안국약품 브이팩 다이어트 유산균 올인원 멀티 비타민 7포 ,5000,4.6,237
20260419,591580541,68,종근당건강, 종근당건강 눈건강엔 루테인지아잔틴 ,5000,4.8,615
20260419,611982831,69,안국약품, 안국약품 토비콤 루테인 지아잔틴 미니 30캡슐 ,5000,4.8,576
20260419,225903045,70,롯데, 롯데 ABC 초코 60 g ,2000,4.8,65
20260419,921556556,71,녹차, 녹차 맛 마카로니 과자 65 g ,1000,4.8,747
20260419,104557163,72,오뚜기, 오뚜기 진라면 용기 매운맛 110 g ,1000,4.9,209
20260419,031930043,73,닥터블릿, 닥터블릿 멜라드림 30정 30일분 ,5000,4.8,259
20260419,012600604,74,로투스, 로투스 비스코프 125 g ,1500,4.8,547
20260419,120420585,75,청우, 청우 찹쌀 모나카 65 g ,1500,4.8,617
20260419,111118048,76,크라운, 크라운 빅파이 216 g ,2000,4.8,300
20260419,106286179,77,롯데, 롯데 치토스 매콤달콤맛 64 g ,1000,4.9,68
20260419,190616519,78,코스모스, 코스모스 버터갈릭 새우칩 56g ,1000,4.8,1536
20260419,106238271,79,롯데, 롯데 쌀로 만든 쌀로별 고소한 맛 62 g ,1000,4.9,70
20260419,902596193,80,애사비, 애사비 톡 매실 5 g X 10개입 ,3000,4.8,420
20260419,104557309,81,오뚜기, 오뚜기 스낵면 용기 90 g ,1000,4.8,234
20260419,574247432,82,하이디라오, 하이디라오 마라펀 ,2000,4.8,280
20260419,600000130,83,대웅제약, 대웅제약 글루타치온 30정 30일분 ,5000,4.8,837
20260419,925667703,84,오트밀, 오트밀 미니 바이트 40g ,1000,4.9,566
20260419,106224743,85,롯데, 롯데 칙촉 120 g ,2000,4.8,43
20260419,601618641,86,동화, 동화 바이마그랩 마그네슘 테아닌 5포 5일분 ,3000,4.9,16
20260419,591580521,87,종근당건강, 종근당건강 락토핏 골드 ,5000,4.8,744
20260419,286314184,88,영진, 영진 비타민D 1000IU 아연 츄어블 12정 ,1000,4.8,55
20260419,702591115,89,하타리, 하타리 말키스트 120 g 초콜릿 맛 ,1000,4.7,385
20260419,902596192,90,애사비, 애사비 톡 사과 5 g X 10개입 ,3000,4.9,384
20260419,106201272,91,롯데, 롯데 아몬드 빼빼로 37 g ,1500,4.9,382
20260419,926940063,92,추억의, 추억의 과자 꾀돌이 75 g ,1000,4.8,482
20260419,225903048,93,롯데, 롯데 아몬드 초코 볼 46 g ,2000,4.8,53
20260419,600000140,94,대웅제약, 대웅제약 맥주효모 비오틴 30정 30일분 ,5000,4.8,585
20260419,600000139,95,대웅제약, 대웅제약 쏘팔메토 옥타코사놀 30캡슐 30일분 ,5000,4.8,732
20260419,600132084,96,코피코, 코피코 캔디 100 g 커피 맛 ,1500,4.8,603
20260419,699520507,97,미성, 미성 화이트 캐슬 버터 쿠키 ,1000,4.7,903
20260419,947020018,98,청해, 청해 꼬꼬마 오징어 숏다리 30g ,2000,4.8,663
20260419,921556550,99,추억, 추억 나눔 뻥튀기 44 g ,1000,4.8,452
20260419,104556003,100,오뚜기, 오뚜기 뿌셔뿌셔 불고기 맛 90 g X 2개입 ,1500,4.8,294
20260419,600000207,101,대웅제약, 대웅제약 알파CD ZERO 15포 15일분 ,5000,4.8,122
20260419,938846464,102,이디야, 이디야 비니스트 오리지널 아메리카노 1 g X 12개입 ,2000,4.8,238
20260419,601618642,103,동화, 동화 바이마그랩 마그네슘 식이섬유 5포 5일분 ,3000,4.9,78
20260419,965923433,104,홀베리, 홀베리 유기농 레몬자몽즙 10포 ,5000,4.6,125
20260419,613602131,105,오브맘, 오브맘 비타민C＆E 하루구미 30일분 ,5000,4.7,308
20260419,601618643,106,동화, 동화 바이마그랩 마그네슘B 30정 30일분 ,3000,5.0,56
20260419,646710535,107,프링글스, 프링글스 사워크림 앤 어니언 53 g ,1500,4.8,542
20260419,104529401,108,오뚜기, 오뚜기 3분 김치참치덮밥 소스 150 g ,1500,4.8,211
20260419,099715606,109,드롭, 드롭 어소티드 소프트캔디 75g ,1000,4.9,388
20260419,921556571,110,토마토, 토마토 캔디 40 g ,1000,4.6,257
20260419,204942093,111,카스텔크렘, 카스텔크렘 레몬 캔디 50 g ,2000,4.8,593
20260419,964455538,112,본죽, 본죽 쇠고기죽 200g ,2000,4.7,301
20260419,613602127,113,오브맘, 오브맘 더채움 비오틴 하루구미 30일분 ,5000,4.9,187
20260419,458877369,114,북해도, 북해도 우유 모찌 40 g ,2000,4.4,662
20260419,982725060,115,허쉬, 허쉬 초콜릿 칩 모찌 쿠키 90 g ,1500,4.8,653
20260419,109446260,116,휘오, 휘오 순수 500 ml ,500,4.8,90
20260419,610910602,117,동국제약, 동국제약 마데카 리포좀 글루타치온C 20포 ,5000,4.8,440
20260419,104576228,118,진라면, 진라면 스프 5g 10개입 순한맛 ,3000,4.8,190
20260419,942788229,119,광천김, 광천김 재래도시락김(4 gx3봉) ,1000,4.8,293
20260419,289600078,120,호박, 호박 꿀맛나 100g ,1000,4.8,469
20260419,901762097,121,자연관, 자연관 홍삼정 에너타임 10포 ,5000,4.8,446
20260419,702591189,122,하타리, 하타리 말키스트 120 g 치즈 맛 ,1000,4.7,293
20260419,600201582,123,광동, 광동 비타500 젤리 48g ,1000,4.8,351
20260419,483400937,124,게메즈, 게메즈 에낙 30 g X 4개입 ,2000,4.9,138
20260419,600000206,125,대웅제약, 대웅제약 베르베린 500 30정 30일분 ,5000,4.8,170
20260419,104568419,126,오뚜기, 오뚜기 컵누들 참깨 라면 ,1500,4.8,115
20260419,921556555,127,녹차, 녹차 맛 강냉이 과자 80 g ,1000,4.8,407
20260419,155890322,128,움트리, 움트리 쇠고기 볶음고추장 100g ,2000,4.8,600
20260419,938846640,129,이디야, 이디야 스페셜 아로마 블렌드 헤이즐넛 향 커피믹스 20개입 ,3000,4.7,328
20260419,496300224,130,미고랭, 미고랭 라면 70 g ,1000,4.7,499
20260419,120400494,131,청우, 청우 참깨스틱 ,1500,4.8,619
20260419,113300431,132,민속, 민속 통 육포 35g ,2000,4.8,518
20260419,964455540,133,본죽, 본죽 얼큰 낙지 김치죽 200g ,2000,4.5,601
20260419,917054202,134,테일러팜스, 테일러팜스 테일러 푸룬 50 g ,1500,4.7,372
20260419,925667933,135,허쉬, 허쉬 다크초콜릿 아사이＆블루베리 28g ,1000,4.8,384
20260419,289600277,136,빼빼어포, 빼빼어포 오리지널 24g ,1000,4.7,522
20260419,104529941,137,오뚜기, 오뚜기 옛날 사골곰탕 350 ml ,1000,4.8,191
20260419,531910198,138,해피무, 해피무 초코렛 비스켓 80 g ,1000,4.8,412
20260419,221024842,139,밀카, 밀카 초코무 40 g ,1000,4.8,101
20260419,610910679,140,동국제약, 동국제약 리포좀 비타민C 30정 ,5000,4.8,277
20260419,113300102,141,머거본, 머거본 커피 땅콩 55g ,1000,4.8,476
20260419,600132083,142,코피코, 코피코 캔디 100 g 카푸치노 맛 ,1500,4.9,433
20260419,965923424,143,홀베리, 홀베리 유기농 레몬생강즙 10포 ,5000,4.7,88
20260419,245610601,144,슬림, 슬림 육포 20g  ,2000,4.8,307
20260419,951817117,145,[한정수량, [한정수량 랜덤 스티커 포함] 락피도 티니핑 면역스틱 12포 ,5000,4.9,176
20260419,190616407,146,코스모스, 코스모스 트위스트 128 g ,1000,4.8,534
20260419,531910918,147,포테이토, 포테이토 크리스프 바베큐맛 75g ,1000,4.8,700
20260419,919157055,148,휴럼, 휴럼 하루한포 쌍화차 5포 5일분 ,2000,4.8,30
20260419,104557457,149,오뚜기, 오뚜기 진짬뽕 미니컵 75 g ,1000,4.9,164
20260419,949000068,150,피오디, 피오디 레몬즙 200 ml ,1500,4.8,555
20260419,104502247,151,오뚜기, 오뚜기 보들보들 치즈 볶음면 매운맛 ,1500,4.9,23
20260419,113300016,152,머거본, 머거본 알 땅콩 55g ,1000,4.8,353
20260419,49811353,153,모리나가, 모리나가 라무네 포도당 캔디 29 g ,1000,4.7,495
20260419,104557068,154,오뚜기, 오뚜기 열라면 작은컵 6개입 ,5000,4.9,174
20260419,610910777,155,동국제약, 동국제약 비타민D 2000IU 40캡슐 40일분 ,3000,4.9,164
20260419,610910603,156,동국제약, 동국제약 마데카 저분자 콜라겐C ,5000,4.8,282
20260419,106201270,157,롯데, 롯데 오리지널 빼빼로 54 g ,1500,4.8,230
20260419,613602146,158,자연관, 자연관 바이탈 밀크씨슬＆비타민B 4병 ,5000,4.9,103
20260419,286314174,159,닥터블릿, 닥터블릿 푸응 7days 데일리버닝 14포 7일분 ,5000,4.6,84
20260419,104557458,160,오뚜기, 오뚜기 진짬뽕 용기 115 g ,1500,4.9,171
20260419,968235547,161,안국약품, 안국약품 브이팩 남성용 올인원 멀티 비타민 7포 ,5000,4.8,182
20260419,935817111,162,출출할땐, 출출할땐 출추리 훈제맛(25 g) ,1500,4.7,191
20260419,994953534,163,LG생활건강, LG생활건강 이너뷰 칼륨밸런스 전해질워터 10포 ,5000,4.8,271
20260419,103900887,164,사조, 사조 팝콘 달콤한 맛 ,1000,4.7,70
20260419,944182826,165,허쉬, 허쉬 초코 아몬드 찰떡 파이 88 g ,1500,4.7,526
20260419,600000141,166,대웅제약, 대웅제약 블랙마카 60정 30일분 ,5000,4.8,330
20260419,104557136,167,오뚜기, 오뚜기 진라면 용기 순한맛 110 g ,1000,4.9,122
20260419,712266879,168,망고큐브젤리(50, 망고큐브젤리(50 g) ,1000,4.7,665
20260419,942788230,169,광천, 광천 재래 곱창 김 4 g X 3봉 ,1000,4.8,170
20260419,032306202,170,종근당, 종근당 데일리와이즈 코엔자임Q10 12캡슐 12일분 ,2000,,0
20260419,919157054,171,휴럼, 휴럼 하루한포 구증구포 흑삼제로 5포 5일분 ,2000,4.9,22
20260419,951817120,172,[한정수량, [한정수량 랜덤 스티커 포함] 락피도 티니핑 철분스틱 12포 ,5000,4.9,116
20260419,106286178,173,롯데, 롯데 치토스 스모키바베큐맛 64 g ,1000,4.9,70
20260419,902596195,174,애사비, 애사비 톡 오미자 5 g X 10개입 ,3000,4.8,224
20260419,277534495,175,게리, 게리 살룻 코코넛 76 g ,1000,4.7,468
20260419,104557028,176,오뚜기, 오뚜기 진라면 매운맛 작은컵 6개입 ,5000,4.9,203
20260419,106252142,177,롯데, 롯데 샌드 파인애플 79 g ,1000,4.9,32
20260419,600000197,178,대웅제약, 대웅제약 밀크씨슬 에너지샷 5포 ,5000,4.9,113
20260419,032306200,179,종근당, 종근당 데일리와이즈 멀티비타민 미네랄 12정 12일분 ,2000,,0
20260419,982725153,180,리치, 리치 허니 쌀과자 120 g ,2000,4.8,327
20260419,600651648,181,유한양행, 유한양행 장건강 생유산균 스틱 30포 30일분 ,5000,4.9,50
20260419,905440019,182,요뽀끼, 요뽀끼 치즈 떡볶이 120 g ,2000,4.7,547
20260419,121609907,183,하리보, 하리보 믹스 사우어 80 g ,1500,4.9,282
20260419,951817121,184,[한정수량, [한정수량 랜덤 스티커 포함] 락피도 티니핑 쾌변스틱 12포 ,5000,4.8,103
20260419,600651652,185,유한양행, 유한양행 초코맛 생유산균 스틱 20포 20일분 ,5000,4.9,35
20260419,104551251,186,오뚜기, 오뚜기 컵누들 마라탕 맛 ,1500,4.7,116
20260419,610910601,187,동국제약, 동국제약 마데카 리포좀 레티놀C 20포 ,5000,4.8,359
20260419,289600433,188,옥수수, 옥수수 쫀드기 84g ,1000,4.8,284
20260419,600651650,189,유한양행, 유한양행 비피더스 생유산균 10캡슐 10일분 ,5000,4.9,21
20260419,964455539,190,본죽, 본죽 보양 삼계죽 200g ,2000,4.8,310
20260419,120420547,191,청우, 청우 사르르 버터 쿠키 83 g ,1000,4.7,702
20260419,902596194,192,애사비, 애사비 톡 블루베리 5 g X 10개입 ,3000,4.9,221
20260419,478200696,193,감자알칩, 감자알칩 70 g ,1500,4.8,536
20260419,955960247,194,챠챠, 챠챠 해바라기씨 고소한 맛 45 g ,1000,4.7,254
20260419,336800055,195,알버트, 알버트 동전 초콜릿 망 55 g ,2000,4.7,25
20260419,948699024,196,크래용, 크래용 신짱 라면 스낵 바베큐 맛 90 g ,1000,4.6,362
20260419,591591440,197,종근당건강, 종근당건강 브이퍼센트 멀티비타민 타우린샷 5포 ,5000,4.8,191
20260419,104514115,198,오뚜기, 오뚜기 골드 마요네즈 200 g ,2000,4.8,271
20260419,120420600,199,청우, 청우 그랑쉘 딸기 ,1500,4.8,200
20260419,289600434,200,호박쫀드기, 호박쫀드기 84g ,1000,4.7,222
20260419,951817122,201,[한정수량, [한정수량 랜덤 스티커 포함] 락피도 티니핑 아르기닌스틱 12포 ,5000,4.9,112
20260419,106289354,202,롯데, 롯데 ABC 초코 쿠키 50 g ,1000,4.8,29
20260419,961794509,203,허니, 허니 버터 아몬드 40g ,1500,4.9,280
20260419,629180143,204,타타와, 타타와 초콜릿 쿠키 60 g ,1000,4.7,429
20260419,289600520,205,철판에, 철판에 메메 잘 구운 쥐포 48g ,2000,4.6,375
20260419,905440384,206,요뽀끼, 요뽀끼 매콤 까르보나라 떡볶이 120 g ,2000,4.8,539
20260419,032306204,207,종근당, 종근당 데일리와이즈 밀크씨슬 12정 12일분 ,2000,,0
20260419,968672901,208,맥시콘, 맥시콘 55 g ,1000,4.7,312
20260419,921556557,209,앵두콘, 앵두콘 과자 80 g ,1000,4.6,327
20260419,120400778,210,청우, 청우 미니 웨하스 바닐라 맛 80 g ,1000,4.7,455
20260419,027312009,211,딜리노쉬, 딜리노쉬 땅콩버터 5개입 ,5000,4.7,293
20260419,925667934,212,허쉬, 허쉬 다크초콜릿 석류 28g ,1000,4.7,317
20260419,924797540,213,생고구맛탕, 생고구맛탕 칩 80 g ,2000,4.5,242
20260419,913624077,214,오브맘, 오브맘 기억력 그린라이트 30일분 ,5000,4.7,209
20260419,155890321,215,움트리, 움트리 생와사비 43g ,2000,4.8,501
20260419,104529130,216,오뚜기, 오뚜기 3분 짜장 200 g ,1500,4.8,188
20260419,032627033,217,자연관, 자연관 스파이크컷 바나바잎＆카테킨 4병 ,5000,4.8,130
20260419,104529031,218,오뚜기, 오뚜기 3분 카레 약간매운맛 200 g ,1500,4.9,164
20260419,104520221,219,오뚜기, 오뚜기 사과 식초 500 ml ,1500,4.8,220
20260419,591591420,220,종근당건강, 종근당건강 브이퍼센트 멀티비타민 콜라겐샷 5포 ,5000,4.9,124
20260419,994953528,221,LG생활건강, LG생활건강 이너뷰 콜라겐 더마스틱 7포 ,5000,4.7,128
20260419,935144292,222,자두, 자두 녹차 340 ml ,1000,4.9,123
20260419,802403402,223,쟈뎅, 쟈뎅 바리스타 싱글오리진 브라질 캡슐 커피 미디엄 10개입 ,5000,4.8,69
20260419,802403401,224,쟈뎅, 쟈뎅 바리스타 싱글오리진 브라질 캡슐 커피 다크 10개입 ,5000,4.8,115
20260419,106285943,225,롯데, 롯데 키세스 밀크 31 g ,1000,4.9,12
20260419,613602126,226,오브맘, 오브맘 눈건강 루테인 하루구미 30일분 ,5000,4.8,351
20260419,591580761,227,종근당건강, 종근당건강 락토핏 당케어 ,5000,4.7,317
20260419,104529032,228,오뚜기, 오뚜기 3분카레 매운맛 200 g ,1500,5.0,162
20260419,600651651,229,유한양행, 유한양행 프레쉬츄 생유산균 30정 30일분 ,5000,4.8,28
20260419,600000149,230,대웅제약, 대웅제약 MSM 90정 30일분 ,5000,4.8,419
20260419,901762093,231,자연관, 자연관 정성담은 배도라지스틱 12포 ,5000,4.8,342
20260419,456322014,232,오라이시, 오라이시 베트남쌀국수컵(71 g) ,1500,4.6,20
20260419,104529330,233,오뚜기, 오뚜기 3분 하이라이스 소스 200 g ,1500,4.8,138
20260419,961794514,234,바프, 바프 카라멜 솔티드 아몬드 앤 프레첼 40 g ,1500,4.7,220
20260419,939534043,235,우주, 우주 추억의 달고나 45g  ,1000,4.7,369
20260419,643701702,236,오키오, 오키오 구미 100 g 그레이프 ,1500,4.8,81
20260419,245609079,237,달콤한, 달콤한 직화 육포 25g ,2000,4.8,224
20260419,120420568,238,청우, 청우 고구마 모나카 65g ,1500,4.6,971
20260419,113300074,239,머거본, 머거본 칼몬드 35 g ,2000,4.8,90
20260419,600000202,240,대웅제약, 대웅제약 활성엽산400 30정 30일분 ,5000,4.8,98
20260419,942788193,241,두, 두 번 구운 김밥 김 10매입 ,2000,4.8,262
20260419,802403403,242,쟈뎅, 쟈뎅 바리스타 싱글오리진 브라질 캡슐 커피 디카페인 10개입 ,5000,4.7,117
20260419,961794805,243,바프, 바프 와사비맛 땅콩 55g ,1000,4.8,362
20260419,106200942,244,롯데, 롯데 제크 65 g ,1000,4.9,17
20260419,104552631,245,오뚜기, 오뚜기 진비빔면 멀티팩 156 g  X 4개입 ,3000,4.8,145
20260419,289600432,246,월드컵, 월드컵 맛기차 콘 84g  ,1000,4.8,296
20260419,288897426,247,모리나가, 모리나가 하이츄 스윗 앤 사우어 90g ,2000,4.9,306
20260419,288822321,248,모리나가, 모리나가 오리지널믹스 하이츄 (90 g) ,2000,5.0,20
20260419,120400779,249,청우, 청우 미니 웨하스 딸기 맛 80 g ,1000,4.7,499
20260419,104529404,250,오뚜기, 오뚜기 3분 춘천 닭갈비 덮밥 소스 150 g ,1500,4.8,195
20260419,921440142,251,행복한, 행복한 쇼콜라띠에 화이트초코 100 g ,2000,4.9,295
20260419,629180141,252,타타와, 타타와 블루베리잼 쿠키 60 g ,1000,4.7,285
20260419,302920627,253,트러플, 트러플 초콜릿 피스타치오 향 80 g ,1500,,0
20260419,274710519,254,헬로키티, 헬로키티 껌 27.5 g ,1000,4.7,186
20260419,600000138,255,대웅제약, 대웅제약 콜라겐 60정 30일분 ,5000,4.8,606
20260419,225902109,256,롯데, 롯데 자일리톨 알파 용기 48 g ,2000,4.9,29
20260419,136080346,257,부르봉, 부르봉 페투치니 포도 50 g ,2000,4.8,98
20260419,955960244,258,챠챠, 챠챠 해바라기씨 양념 맛 45 g ,1000,4.8,333
20260419,932294263,259,참소스, 참소스 275g ,2000,4.9,557
20260419,76224935,260,밀카, 밀카 초코 슈프림 30 g ,1000,4.6,62
20260419,109436270,261,파워에이드, 파워에이드 마운틴 블라스트 600ml ,1500,4.9,135
20260419,947020027,262,청해추억의빵쥐포(40, 청해추억의빵쥐포(40 g) ,2000,4.8,164
20260419,935817110,263,출출할땐, 출출할땐 출추리 매운맛 25 g ,1500,4.8,118
20260419,154404007,264,밀펑, 밀펑 과자 70 g ,1000,4.7,284
20260419,712266874,265,망고스틴, 망고스틴 큐브 젤리 50 g ,1000,4.5,13
20260419,600000151,266,대웅제약, 대웅제약 숙취해소 노니샷 5포 5회분 ,5000,4.8,168
20260419,113300101,267,머거본, 머거본 꿀땅콩 55g ,1000,4.8,400
20260419,600000142,268,대웅제약, 대웅제약 멀티비타민 미네랄 츄어블 60정 30일분 ,5000,4.8,276
20260419,443310128,269,고소한, 고소한 치즈봉 90 g ,1500,4.7,236
20260419,289600420,270,꼬마, 꼬마 꾸이킹 오리지널 25g ,1000,4.8,284
20260419,111533852,271,서울우유, 서울우유 딸기우유 맛 젤리 45 g ,1000,4.4,319
20260419,944992002,272,우주, 우주 수제 달고나 20g  ,1000,4.9,125
20260419,613602128,273,오브맘, 오브맘 멀티비타민＆미네랄 하루구미 30일분 ,5000,4.8,279
20260419,605276084,274,코키, 코키 치즈 크래커 80 g ,1000,4.7,315
20260419,252021099,275,추억의, 추억의 차카니 60g ,1000,4.7,463
20260419,121609555,276,하리보, 하리보 웜즈 사우어 80 g ,1500,4.9,269
20260419,699520508,277,미성, 미성 화이트 캐슬 초콜릿칩 버터 쿠키 ,1000,4.7,489
20260419,106288364,278,롯데, 롯데 크런키 빼빼로 39 g ,1500,4.9,194
20260419,106201274,279,롯데, 롯데 초코쿠키 빼빼로 37 g ,1500,4.8,136
20260419,104529030,280,오뚜기, 오뚜기 3분 카레 순한맛 200 g ,1500,4.9,94
20260419,994953531,281,LG생활건강, LG생활건강 이너뷰 히알루론산 더마스틱 12포 ,5000,4.8,152
20260419,109498420,282,씨그램, 씨그램 플레인 350 ml ,1000,4.7,24
20260419,015740105,283,벤토, 벤토 스위트＆스파이시 12 g ,1000,4.8,150
20260419,225902105,284,롯데, 롯데 졸음껌 오리지날 리필 70 g ,3000,4.7,15
20260419,112102997,285,매일유업, 매일유업 메디웰 고단백플러스 ,1500,4.7,49
20260419,299352571,286,브라우니, 브라우니 믹스 230 g ,3000,4.6,109
20260419,203590173,287,하리보, 하리보 스타 믹스 100 g ,1500,4.9,203
20260419,111194673,288,크라운, 크라운 죠리퐁 138 g ,2000,4.9,102
20260419,940695893,289,미루, 미루 러브 틴케이스 18 g ,1000,4.2,49
20260419,84197382,290,메가, 메가 수퍼 피카 줌 버블껌 캔디 20 g ,500,4.4,27
20260419,982725115,291,허쉬, 허쉬 바닐라 크림 샌드위치 쿠키 75 g ,1000,4.8,449
20260419,938846465,292,이디야, 이디야 비니스트 스페셜 에디션 1 g X 12개입 ,2000,4.6,79
20260419,104529402,293,오뚜기, 오뚜기 3분 낙지덮밥 소스 150 g ,1500,4.7,159
